[
  {
    "id": "main-a",
    "kind": "main",
    "name": "A",
    "order": 1,
    "stages": [
      {
        "name": "A",
        "imageKey": "characters/a/main",
        "battle": {
          "hp": 2000,
          "attack": 400,
          "defence": 500,
          "attribute": "yang",
          "attackBuffRate": 0.5,
          "defenceBuffAmount": 10,
          "fixedAttackPower": 500,
          "strongAttackPower": 1000,
          "recoveryRate": 0,
          "changeAttribute": null,
          "attackDebuff": 0,
          "defenceDebuff": 0,
          "turns": [
            "defend",
            "attack",
            "defend",
            "provocation",
            "strongAttack",
            "defend",
            "attack",
            "concentration",
            "fixedAttack",
            "deathblow"
          ]
        },
        "revealCount": 1
      }
    ],
    "rewards": {
      "recruit": "a",
      "weatherItems": false
    }
  },
  {
    "id": "main-b",
    "kind": "main",
    "name": "B",
    "order": 2,
    "stages": [
      {
        "name": "B",
        "imageKey": "characters/b/main",
        "battle": {
          "hp": 5000,
          "attack": 300,
          "defence": 300,
          "attribute": "note",
          "attackBuffRate": 0.5,
          "defenceBuffAmount": 200,
          "fixedAttackPower": 500,
          "strongAttackPower": 0,
          "recoveryRate": 0,
          "changeAttribute": null,
          "attackDebuff": 0,
          "defenceDebuff": 0,
          "turns": [
            "attack",
            "attackBuff",
            "defend",
            "attack",
            "attackBuff",
            "attack",
            "fixedAttack",
            "attackBuff",
            "attackBuff",
            "defend",
            "attack",
            "attack",
            "provocation",
            "concentration",
            "deathblow"
          ]
        },
        "revealCount": 1
      }
    ],
    "rewards": {
      "recruit": "b",
      "weatherItems": false
    }
  },
  {
    "id": "main-c",
    "kind": "main",
    "name": "C",
    "order": 3,
    "stages": [
      {
        "name": "C",
        "imageKey": "characters/c/main",
        "battle": {
          "hp": 2000,
          "attack": 1000,
          "defence": 10,
          "attribute": "moon",
          "attackBuffRate": 0.5,
          "defenceBuffAmount": 10,
          "fixedAttackPower": 0,
          "strongAttackPower": 0,
          "recoveryRate": 0,
          "changeAttribute": null,
          "attackDebuff": 0,
          "defenceDebuff": 0,
          "turns": [
            "attack",
            "attack",
            "attack",
            "attack",
            "attack",
            "attack",
            "attack",
            "deathblow"
          ]
        },
        "revealCount": 1
      }
    ],
    "rewards": {
      "recruit": "c",
      "weatherItems": false
    }
  },
  {
    "id": "main-d",
    "kind": "main",
    "name": "D",
    "order": 4,
    "stages": [
      {
        "name": "D",
        "imageKey": "characters/d/main",
        "battle": {
          "hp": 3100,
          "attack": 630,
          "defence": 40,
          "attribute": "yang",
          "attackBuffRate": 0.5,
          "defenceBuffAmount": 40,
          "fixedAttackPower": 0,
          "strongAttackPower": 0,
          "recoveryRate": 0,
          "changeAttribute": null,
          "attackDebuff": 0,
          "defenceDebuff": 0,
          "turns": [
            "attack",
            "defend",
            "attack",
            "defend",
            "attack",
            "defend",
            "deathblow"
          ]
        },
        "revealCount": 1
      }
    ],
    "rewards": {
      "recruit": "d",
      "weatherItems": false
    }
  },
  {
    "id": "main-e",
    "kind": "main",
    "name": "E",
    "order": 5,
    "stages": [
      {
        "name": "E",
        "imageKey": "characters/e/main",
        "battle": {
          "hp": 4000,
          "attack": 500,
          "defence": 300,
          "attribute": "yang",
          "attackBuffRate": 0.5,
          "defenceBuffAmount": 300,
          "fixedAttackPower": 0,
          "strongAttackPower": 0,
          "recoveryRate": 0,
          "changeAttribute": null,
          "attackDebuff": 0,
          "defenceDebuff": 0,
          "turns": [
            "defend",
            "defend",
            "defend",
            "attack",
            "defend",
            "defend",
            "attack",
            "defend",
            "deathblow"
          ]
        },
        "revealCount": 1
      }
    ],
    "rewards": {
      "recruit": "e",
      "weatherItems": false
    }
  },
  {
    "id": "main-f",
    "kind": "main",
    "name": "F",
    "order": 6,
    "stages": [
      {
        "name": "F",
        "imageKey": "characters/f/main",
        "battle": {
          "hp": 1250,
          "attack": 2000,
          "defence": 200,
          "attribute": "moon",
          "attackBuffRate": 0.5,
          "defenceBuffAmount": 200,
          "fixedAttackPower": 1000,
          "strongAttackPower": 0,
          "recoveryRate": 0,
          "changeAttribute": null,
          "attackDebuff": 0,
          "defenceDebuff": 0,
          "turns": [
            "attack",
            "attack",
            "fixedAttack",
            "attack",
            "attack",
            "defend",
            "attack",
            "attack",
            "deathblow"
          ]
        },
        "revealCount": 1
      }
    ],
    "rewards": {
      "recruit": "f",
      "weatherItems": false
    }
  },
  {
    "id": "main-g",
    "kind": "main",
    "name": "G",
    "order": 7,
    "stages": [
      {
        "name": "G",
        "imageKey": "characters/g/main",
        "battle": {
          "hp": 6000,
          "attack": 400,
          "defence": 700,
          "attribute": "note",
          "attackBuffRate": 0.5,
          "defenceBuffAmount": 350,
          "fixedAttackPower": 0,
          "strongAttackPower": 0,
          "recoveryRate": 0,
          "changeAttribute": null,
          "attackDebuff": 0,
          "defenceDebuff": 0,
          "turns": [
            "defenceBuff",
            "attack",
            "defenceBuff",
            "attack",
            "defenceBuff",
            "defend",
            "attack",
            "defend",
            "defend",
            "attack",
            "defend",
            "defend",
            "deathblow"
          ]
        },
        "revealCount": 1
      }
    ],
    "rewards": {
      "recruit": "g",
      "weatherItems": false
    }
  },
  {
    "id": "main-i",
    "kind": "main",
    "name": "I",
    "order": 8,
    "stages": [
      {
        "name": "B!",
        "imageKey": "characters/i/main",
        "battle": {
          "hp": 5000,
          "attack": 2000,
          "defence": 300,
          "attribute": "note",
          "attackBuffRate": 0.5,
          "defenceBuffAmount": 350,
          "fixedAttackPower": 0,
          "strongAttackPower": 2500,
          "recoveryRate": 0,
          "changeAttribute": null,
          "attackDebuff": 0,
          "defenceDebuff": 0,
          "turns": [
            "attack",
            "defend",
            "defend",
            "defend",
            "defend",
            "defend",
            "strongAttack",
            "defend",
            "defend",
            "defend",
            "attack",
            "deathblow"
          ]
        },
        "revealCount": 1
      },
      {
        "name": "I",
        "imageKey": "characters/i/main",
        "battle": {
          "hp": 5000,
          "attack": 1500,
          "defence": 200,
          "attribute": "note",
          "attackBuffRate": 0.5,
          "defenceBuffAmount": 200,
          "fixedAttackPower": 0,
          "strongAttackPower": 2000,
          "recoveryRate": 0,
          "changeAttribute": null,
          "attackDebuff": 0,
          "defenceDebuff": 0,
          "turns": [
            "strongAttack",
            "strongAttack",
            "strongAttack",
            "defend",
            "defend",
            "provocation",
            "concentration",
            "deathblow"
          ]
        },
        "revealCount": 1
      }
    ],
    "rewards": {
      "recruit": "i",
      "weatherItems": false
    }
  },
  {
    "id": "main-j",
    "kind": "main",
    "name": "J",
    "order": 9,
    "stages": [
      {
        "name": "J",
        "imageKey": "characters/j/main",
        "battle": {
          "hp": 20000,
          "attack": 800,
          "defence": 200,
          "attribute": "note",
          "attackBuffRate": 0.5,
          "defenceBuffAmount": 200,
          "fixedAttackPower": 0,
          "strongAttackPower": 2500,
          "recoveryRate": 0,
          "changeAttribute": null,
          "attackDebuff": 0,
          "defenceDebuff": 0,
          "turns": [
            "defenceBuff",
            "attack",
            "attackBuff",
            "attackBuff",
            "defend",
            "attack",
            "defend",
            "attackBuff",
            "attack",
            "defend",
            "attack",
            "defenceBuff",
            "defenceBuff",
            "attackBuff",
            "attack",
            "strongAttack",
            "defend",
            "defenceBuff",
            "deathblow"
          ]
        },
        "revealCount": 2
      }
    ],
    "rewards": {
      "recruit": "j",
      "weatherItems": false
    }
  },
  {
    "id": "main-l",
    "kind": "main",
    "name": "L",
    "order": 10,
    "stages": [
      {
        "name": "L",
        "imageKey": "characters/l/main",
        "battle": {
          "hp": 23000,
          "attack": 800,
          "defence": 200,
          "attribute": "yang",
          "attackBuffRate": 0.5,
          "defenceBuffAmount": 200,
          "fixedAttackPower": 0,
          "strongAttackPower": 0,
          "recoveryRate": 0,